{
  "$schema": "http://json-schema.org/draft-07/schema#",
  "$id": "https://clawrocket.dev/contracts/editorial-room/v0/proposal_card.schema.json",
  "title": "ProposalCard",
  "description": "Discrete unit of agent-proposed change. User accepts/edits/rejects/parks each proposal individually. See EDITORIAL_ROOM_CONTRACT.md §4.5. Per §10 ProposedDiff is described as 'oneOf by target_object.kind' but the contract code-level type is Record<string, unknown>; strict per-kind discrimination is deferred — we ship ProposedDiff as type:object and document the per-kind shape contract in the field description.",
  "type": "object",
  "additionalProperties": false,
  "definitions": {
    "ProposedDiff": {
      "type": "object",
      "description": "Shape varies by parent ProposalCard.target_object.kind:\n- theme: { name?, description?, status? }\n- topic: { working_title?, thesis?, why_now?, status? }\n- point: { claim?, rationale?, evidence_add?, evidence_remove?, conviction?, status? }\n- outline: { sections?, hook_options?, payoff? }\n- draft: see §4.6+§5.\nJSON Schema enforcement is intentionally permissive; runtime validates against the resolved target object."
    }
  },
  "required": [
    "id",
    "schema_version",
    "source_run_id",
    "source_skill",
    "proposal_kind",
    "target_object",
    "proposed_diff",
    "rationale",
    "agent_attribution",
    "status",
    "user_edit",
    "resolved_at",
    "resolved_by_user_id",
    "resolution_note"
  ],
  "properties": {
    "id": { "type": "string", "minLength": 1, "description": "ULID." },
    "schema_version": { "const": "0" },
    "source_run_id": {
      "type": "string",
      "minLength": 1,
      "description": "Run that produced this proposal."
    },
    "source_skill": {
      "type": "string",
      "minLength": 1,
      "description": "e.g., 'factory_topic_propose', 'factory_point_debate'."
    },
    "proposal_kind": {
      "type": "string",
      "enum": [
        "create_theme",
        "create_topic",
        "create_point",
        "edit_topic",
        "edit_point",
        "merge_points",
        "park_point",
        "promote_note_to_point",
        "improve_toward_score",
        "research_point",
        "outline_section",
        "outline_section_swap",
        "outline_hook_choice"
      ]
    },
    "target_object": {
      "type": "object",
      "additionalProperties": false,
      "required": ["kind", "ref"],
      "properties": {
        "kind": {
          "type": "string",
          "enum": ["theme", "topic", "point", "outline", "draft"]
        },
        "ref": {
          "anyOf": [{ "type": "null" }, { "type": "string", "minLength": 1 }],
          "description": "Slug of the target object; null for create_* proposals."
        }
      }
    },
    "proposed_diff": { "$ref": "#/definitions/ProposedDiff" },
    "rationale": {
      "type": "string",
      "minLength": 1,
      "maxLength": 4096,
      "description": "Why the proposal makes sense. §7 cap: 4 KB."
    },
    "agent_attribution": {
      "type": "array",
      "items": { "type": "string", "minLength": 1 },
      "description": "Which agent profile_ids contributed."
    },
    "status": {
      "type": "string",
      "enum": ["pending", "accepted", "edited", "rejected", "parked"]
    },
    "user_edit": {
      "anyOf": [{ "type": "null" }, { "$ref": "#/definitions/ProposedDiff" }],
      "description": "Populated if status == 'edited'."
    },
    "resolved_at": {
      "anyOf": [{ "type": "null" }, { "type": "string", "format": "date-time" }]
    },
    "resolved_by_user_id": {
      "anyOf": [{ "type": "null" }, { "type": "string", "minLength": 1 }]
    },
    "resolution_note": {
      "anyOf": [{ "type": "null" }, { "type": "string" }]
    }
  }
}
