{
  "id": "01HXYZPROP200BBBBBBBBBBBBBB",
  "schema_version": "0",
  "source_run_id": "01HXYZRUN200BBBBBBBBBBBBBB",
  "source_skill": "factory_point_improve_toward_score",
  "proposal_kind": "improve_toward_score",
  "target_object": {
    "kind": "point",
    "ref": "point/embracer-mg-reclassification-load-bearing"
  },
  "proposed_diff": {
    "claim": "MG-as-conditional-liability is the load-bearing accounting change — without it the deal-shape lockdown collapses inside one quarter.",
    "rationale": "Tightens the causal chain between the accounting change and the deal-shape persistence. Adds a falsifiable temporal claim ('inside one quarter').",
    "evidence_add": [
      {
        "kind": "back_catalog_ref",
        "url": null,
        "ref_slug": "back_catalog/2025-08-publisher-power-shift",
        "quote_text": null,
        "quote_source": null,
        "notes": "Predicts the structural shift; this Point names the mechanism."
      }
    ]
  },
  "rationale": "Point currently scores SSR likelihood mean 0.62 (just under 0.65 gate for primary personas). Tightening the causal chain and adding the back-catalog reference projects to ~0.74 based on rubric judge sensitivity analysis. Recommended accept.",
  "agent_attribution": ["agent/argus"],
  "status": "pending",
  "user_edit": null,
  "resolved_at": null,
  "resolved_by_user_id": null,
  "resolution_note": null
}
