{
  "id": "01HXYZPROP300ACCEPTEDAAAAAA",
  "schema_version": "0",
  "source_run_id": "01HXYZRUN300ACCEPTEDAAAAAAA",
  "source_skill": "factory_topic_propose_optimize",
  "proposal_kind": "create_topic",
  "target_object": {
    "kind": "topic",
    "ref": null
  },
  "proposed_diff": {
    "parent_theme_slug": "theme/ai-impact-on-game-dev",
    "working_title": "How Embracer's writedown changed indie publishing terms",
    "thesis": "Surviving studios are signing 2022-rate deals to keep going — Embracer's writedown shifted bargaining power away from devs in a way locked in for 18+ months.",
    "why_now": "Embracer's Q3 8-K reclassified MGs as conditional liabilities; Devolver's prelim Q4 echoed the change.",
    "status": "active"
  },
  "rationale": "Topic-optimize round 01HXYZABC456PQR789STUVWXYZ ranked this top-K rank 1 by composite (rubric 7.6 + SSR mean 8.0 + novelty bonus 0.15).",
  "agent_attribution": ["agent/argus", "agent/scribe", "agent/mei-cohort"],
  "status": "accepted",
  "user_edit": null,
  "resolved_at": "2026-04-30T11:48:32.140Z",
  "resolved_by_user_id": "user_local_joseph",
  "resolution_note": null
}
