{
  "id": "01HXYZPROP303PARKEDAAAAAAAA",
  "schema_version": "0",
  "source_run_id": "01HXYZRUN303PARKEDAAAAAAAAA",
  "source_skill": "factory_topic_propose_optimize",
  "proposal_kind": "create_topic",
  "target_object": {
    "kind": "topic",
    "ref": null
  },
  "proposed_diff": {
    "parent_theme_slug": "theme/ai-impact-on-game-dev",
    "working_title": "The audio-tools bottleneck in indie pipelines",
    "thesis": "Audio is the last manual stage in a generative-AI-fluent indie pipeline; the gap is structural, not skill-based.",
    "why_now": "ElevenLabs/Suno gains in 2025 are real but the integration story is bad; this is where the next 12 months of wins land.",
    "status": "active"
  },
  "rationale": "Rank 3 of 5 in the optimize round; aggregate 7.0. Solid topic but adjacent to the current Theme rather than core.",
  "agent_attribution": ["agent/argus", "agent/mei-cohort"],
  "status": "parked",
  "user_edit": null,
  "resolved_at": "2026-04-30T11:55:08.330Z",
  "resolved_by_user_id": "user_local_joseph",
  "resolution_note": "Worth writing in the next quarter when ElevenLabs DAW integration matures. Parking — revisit Q3."
}
