{
  "id": "01HXYZPROP302EDITEDAAAAAAAA",
  "schema_version": "0",
  "source_run_id": "01HXYZRUN302EDITEDAAAAAAAAA",
  "source_skill": "factory_point_improve_toward_score",
  "proposal_kind": "improve_toward_score",
  "target_object": {
    "kind": "point",
    "ref": "point/embracer-mg-reclassification-load-bearing"
  },
  "proposed_diff": {
    "claim": "MG-as-conditional-liability is the load-bearing accounting change — without it the deal-shape lockdown collapses inside one quarter.",
    "rationale": "Tightens the causal chain between the accounting change and the deal-shape persistence. Adds a falsifiable temporal claim ('inside one quarter')."
  },
  "rationale": "Point currently scores SSR likelihood mean 0.62 (just under 0.65 gate). Tightening the causal chain projects to ~0.74 based on rubric judge sensitivity analysis.",
  "agent_attribution": ["agent/argus"],
  "status": "edited",
  "user_edit": {
    "claim": "MG-as-conditional-liability is the load-bearing accounting change — without it the deal-shape lockdown unwinds within two quarters.",
    "rationale": "Tightens the causal chain. The 'two quarters' window matches what Annapurna's source said in the verification call; one quarter overstated."
  },
  "resolved_at": "2026-04-30T11:54:41.770Z",
  "resolved_by_user_id": "user_local_joseph",
  "resolution_note": "Accepted the substance; softened 'one quarter' to 'two quarters' to match the Annapurna verification."
}
